{
 "tipologia": "otra_estancia",
 "nombre": "Estudio de pintura",
 "superficie": {
  "ancho": [
   3.2,
   7.8
  ],
  "fondo": [
   2.1,
   5
  ],
  "alto": 2.75
 },
 "variables": {},
 "puerta": -0.75,
 "paso_libre": 0.8,
 "zonas": [
  {
   "id": "estancia",
   "publica": true,
   "rect": [
    "-W/2",
    "0",
    "W/2",
    "D"
   ]
  }
 ],
 "tabiques": [],
 "objetos": [
  {
   "zona": "estancia",
   "regla": "contra_pared",
   "obj": "vb_caballete",
   "pared": "*",
   "cantidad": [
    1,
    1
   ],
   "obligatorio": true,
   "preferir": true
  },
  {
   "zona": "estancia",
   "regla": "contra_pared",
   "obj": "vb_escritorio",
   "pared": "*",
   "cantidad": [
    1,
    1
   ],
   "obligatorio": true,
   "preferir": true
  },
  {
   "zona": "estancia",
   "regla": "junto_a",
   "obj": "silla_comedor",
   "de": "vb_escritorio",
   "cantidad": [
    1,
    1
   ],
   "obligatorio": true,
   "preferir": true,
   "lados": [
    "frente"
   ],
   "mira_ref": true
  },
  {
   "zona": "estancia",
   "regla": "contra_pared",
   "obj": "estanteria_libros",
   "pared": "*",
   "cantidad": [
    0,
    1
   ],
   "obligatorio": false,
   "preferir": true
  },
  {
   "zona": "estancia",
   "regla": "contra_pared",
   "obj": "vb_caballete",
   "pared": "*",
   "cantidad": [
    0,
    1
   ],
   "obligatorio": false,
   "preferir": true,
   "area_min": 12
  },
  {
   "zona": "estancia",
   "regla": "pared",
   "obj": "cuadro_paisaje",
   "pared": "*",
   "cantidad": [
    0,
    1
   ],
   "botin": "cuadro"
  },
  {
   "zona": "estancia",
   "regla": "pared",
   "variantes": [
    "cuadro_paisaje",
    "poster_enmarcado"
   ],
   "pared": "*",
   "cantidad": [
    1,
    3
   ]
  },
  {
   "zona": "estancia",
   "regla": "sobre",
   "variantes": [
    "vb_paleta",
    "vb_pinceles",
    "vb_carboncillos",
    "vb_acuarelas",
    "vb_tubos_oleo",
    "vb_trapo",
    "fe_pintura_blanca",
    "fe_pintura_roja",
    "fe_pintura_azul",
    "fe_pintura_verde",
    "fe_pintura_amarilla",
    "fe_pintura_gris",
    "fe_pintura_cubo",
    "lb_libros_rojos",
    "lb_libros_azules",
    "lb_libros_verdes",
    "lb_libros_ocres",
    "lb_libros_negros",
    "lb_libros_crema",
    "lb_libros_morados",
    "lb_libros_granates",
    "lb_libros_mixtos_a",
    "lb_libros_mixtos_b",
    "lb_libros_infantiles",
    "lb_libros_turquesas",
    "lb_libros_grises",
    "lb_libros_bolsillo",
    "lb_libros_enciclopedia",
    "lb_libros_atlas",
    "lb_pila_novedad_a",
    "lb_pila_novedad_b",
    "lb_pila_novedad_c",
    "lb_pila_grandes",
    "lb_libros_cara_a",
    "lb_libros_cara_b",
    "lb_libros_cara_c",
    "lb_comics_a",
    "lb_comics_b",
    "lb_comics_c",
    "lb_comics_d",
    "lb_cuadernos_espiral",
    "lb_cuadernos_rojos",
    "lb_carpetas_anillas",
    "lb_estuches",
    "lb_rotuladores",
    "lb_papel_folios",
    "lb_sobres",
    "lb_agendas",
    "lb_diccionarios",
    "lb_calculadoras",
    "lb_gomas_tijeras"
   ],
   "en": [
    "vb_escritorio",
    "estanteria_libros"
   ],
   "por_soporte": [
    3,
    6
   ]
  },
  {
   "zona": "estancia",
   "regla": "techo",
   "obj": "lampara_techo_salon",
   "por_m": [
    0.4,
    0.42
   ],
   "obligatorio": true
  }
 ],
 "iluminacion": {
  "fuentes": [
   1,
   3
  ],
  "temperatura_k": [
   2700,
   3000
  ],
  "minimo_lux_publico": 60
 },
 "ambiente": {
  "sonido": "casa",
  "vida": [
   "objetos cotidianos del hogar"
  ]
 },
 "minimo_objetos_distintos": 30,
 "moodboard": [
  {
   "titulo": "Interior of Camille Pissarro s studio at Éragny-sur-Epte - 2026.jpg",
   "url": "https://commons.wikimedia.org/wiki/File:Interior_of_Camille_Pissarro_s_studio_at_%C3%89ragny-sur-Epte_-_2026.jpg",
   "autor": "AlexDS05",
   "licencia": "CC0"
  },
  {
   "titulo": "Peter Wegner Studio Interior 2019.jpg",
   "url": "https://commons.wikimedia.org/wiki/File:Peter_Wegner_Studio_Interior_2019.jpg",
   "autor": "Smallworldsocial",
   "licencia": "CC BY-SA 4.0"
  },
  {
   "titulo": "Artists studio 1.jpg",
   "url": "https://commons.wikimedia.org/wiki/File:Artists_studio_1.jpg",
   "autor": "Pengu1ngaynor",
   "licencia": "CC BY-SA 4.0"
  },
  {
   "titulo": "Artists studio 2.jpg",
   "url": "https://commons.wikimedia.org/wiki/File:Artists_studio_2.jpg",
   "autor": "Pengu1ngaynor",
   "licencia": "CC BY-SA 4.0"
  },
  {
   "titulo": "Fechin Studio Interior.JPG",
   "url": "https://commons.wikimedia.org/wiki/File:Fechin_Studio_Interior.JPG",
   "autor": "Archinia",
   "licencia": "CC BY-SA 3.0"
  },
  {
   "titulo": "Interior of Särestöniemi studio 01.jpg",
   "url": "https://commons.wikimedia.org/wiki/File:Interior_of_S%C3%A4rest%C3%B6niemi_studio_01.jpg",
   "autor": "Htm",
   "licencia": "CC BY-SA 4.0"
  },
  {
   "titulo": "Interior of Särestöniemi studio 02.jpg",
   "url": "https://commons.wikimedia.org/wiki/File:Interior_of_S%C3%A4rest%C3%B6niemi_studio_02.jpg",
   "autor": "Htm",
   "licencia": "CC BY-SA 4.0"
  },
  {
   "titulo": "Interior of Särestöniemi studio 03.jpg",
   "url": "https://commons.wikimedia.org/wiki/File:Interior_of_S%C3%A4rest%C3%B6niemi_studio_03.jpg",
   "autor": "Htm",
   "licencia": "CC BY-SA 4.0"
  },
  {
   "titulo": "Looking down at the first floor of St. Etheldreda's Artist Studio from upstairs - geograph.org.uk - 6408310.jpg",
   "url": "https://commons.wikimedia.org/wiki/File:Looking_down_at_the_first_floor_of_St._Etheldreda%27s_Artist_Studio_from_upstairs_-_geograph.org.uk_-_6408310.jpg",
   "autor": "Robert Lamb",
   "licencia": "CC BY-SA 2.0"
  },
  {
   "titulo": "Hopper's easel.jpg",
   "url": "https://commons.wikimedia.org/wiki/File:Hopper%27s_easel.jpg",
   "autor": "Spinklink",
   "licencia": "CC BY-SA 4.0"
  }
 ]
}