{
 "tipologia": "dormitorio",
 "nombre": "Dormitorio del estudiante",
 "superficie": {
  "ancho": [
   3.2,
   7.8
  ],
  "fondo": [
   2.1,
   5.2
  ],
  "alto": 2.75
 },
 "variables": {},
 "puerta": -0.75,
 "paso_libre": 0.8,
 "zonas": [
  {
   "id": "estancia",
   "publica": true,
   "rect": [
    "-W/2",
    "0",
    "W/2",
    "D"
   ]
  }
 ],
 "tabiques": [],
 "objetos": [
  {
   "zona": "estancia",
   "regla": "contra_pared",
   "obj": "vb_cama_individual",
   "pared": "*",
   "cantidad": [
    1,
    1
   ],
   "obligatorio": true,
   "preferir": true
  },
  {
   "zona": "estancia",
   "regla": "junto_a",
   "obj": "vb_mesita",
   "de": "vb_cama_individual",
   "cantidad": [
    1,
    1
   ],
   "obligatorio": true,
   "preferir": true
  },
  {
   "zona": "estancia",
   "regla": "contra_pared",
   "obj": "vb_escritorio",
   "pared": "*",
   "cantidad": [
    1,
    1
   ],
   "obligatorio": true,
   "preferir": true
  },
  {
   "zona": "estancia",
   "regla": "junto_a",
   "obj": "silla_comedor",
   "de": "vb_escritorio",
   "cantidad": [
    1,
    1
   ],
   "obligatorio": true,
   "preferir": true,
   "lados": [
    "frente"
   ],
   "mira_ref": true
  },
  {
   "zona": "estancia",
   "regla": "contra_pared",
   "obj": "vb_armario",
   "pared": "*",
   "cantidad": [
    1,
    1
   ],
   "obligatorio": true,
   "preferir": true
  },
  {
   "zona": "estancia",
   "regla": "contra_pared",
   "obj": "vb_estante_bajo",
   "pared": "*",
   "cantidad": [
    0,
    1
   ],
   "obligatorio": false,
   "preferir": true
  },
  {
   "zona": "estancia",
   "regla": "contra_pared",
   "obj": "vb_cama_individual",
   "pared": "*",
   "cantidad": [
    0,
    1
   ],
   "obligatorio": false,
   "preferir": true,
   "area_min": 20,
   "habitacion": [
    "ninos"
   ]
  },
  {
   "zona": "estancia",
   "regla": "pared",
   "variantes": [
    "poster_enmarcado",
    "fotos_familia",
    "cuadro_paisaje"
   ],
   "pared": "*",
   "cantidad": [
    1,
    3
   ]
  },
  {
   "zona": "estancia",
   "regla": "contra_pared",
   "obj": "guitarra_soporte",
   "pared": "*",
   "cantidad": [
    0,
    1
   ],
   "obligatorio": false,
   "preferir": true
  },
  {
   "zona": "estancia",
   "regla": "sobre",
   "obj": "vb_ordenador",
   "en": [
    "vb_escritorio"
   ],
   "cantidad": [
    1,
    1
   ]
  },
  {
   "zona": "estancia",
   "regla": "contra_pared",
   "obj": "estanteria_libros",
   "pared": "*",
   "cantidad": [
    0,
    1
   ],
   "obligatorio": false,
   "preferir": true,
   "area_min": 16
  },
  {
   "zona": "estancia",
   "regla": "contra_pared",
   "obj": "mueble_tv",
   "pared": "*",
   "cantidad": [
    0,
    1
   ],
   "obligatorio": false,
   "preferir": true,
   "area_min": 22
  },
  {
   "zona": "estancia",
   "regla": "sobre",
   "obj": "televisor_plano",
   "en": [
    "mueble_tv"
   ],
   "cantidad": [
    1,
    1
   ],
   "area_min": 22
  },
  {
   "zona": "estancia",
   "regla": "enfrente",
   "obj": "sofa_dos_plazas",
   "de": "televisor_plano",
   "cantidad": [
    0,
    1
   ],
   "preferir": true,
   "si_no": false,
   "area_min": 22,
   "area_max": 30
  },
  {
   "zona": "estancia",
   "regla": "enfrente",
   "obj": "sofa_dos_plazas",
   "de": "televisor_plano",
   "cantidad": [
    1,
    1
   ],
   "obligatorio": true,
   "si_no": false,
   "area_min": 30
  },
  {
   "zona": "estancia",
   "regla": "entre",
   "obj": "mesa_centro",
   "a": "televisor_plano",
   "b": "sofa_dos_plazas",
   "cantidad": [
    0,
    1
   ],
   "area_min": 22
  },
  {
   "zona": "estancia",
   "regla": "contra_pared",
   "obj": "vb_comoda",
   "pared": "*",
   "cantidad": [
    0,
    1
   ],
   "obligatorio": false,
   "preferir": true,
   "area_min": 18
  },
  {
   "zona": "estancia",
   "regla": "suelo_libre",
   "obj": "vb_alfombra",
   "cantidad": [
    0,
    1
   ],
   "area_min": 18
  },
  {
   "zona": "estancia",
   "regla": "sobre",
   "variantes": [
    "lb_libros_rojos",
    "lb_libros_azules",
    "lb_libros_verdes",
    "lb_libros_ocres",
    "lb_libros_negros",
    "lb_libros_crema",
    "lb_libros_morados",
    "lb_libros_granates",
    "lb_libros_mixtos_a",
    "lb_libros_mixtos_b",
    "lb_libros_infantiles",
    "lb_libros_turquesas",
    "lb_libros_grises",
    "lb_libros_bolsillo",
    "lb_libros_enciclopedia",
    "lb_libros_atlas",
    "lb_pila_novedad_a",
    "lb_pila_novedad_b",
    "lb_pila_novedad_c",
    "lb_pila_grandes",
    "lb_libros_cara_a",
    "lb_libros_cara_b",
    "lb_libros_cara_c",
    "lb_comics_a",
    "lb_comics_b",
    "lb_comics_c",
    "lb_comics_d",
    "lb_cuadernos_espiral",
    "lb_cuadernos_rojos",
    "lb_carpetas_anillas",
    "lb_estuches",
    "lb_rotuladores",
    "lb_papel_folios",
    "lb_sobres",
    "lb_agendas",
    "lb_diccionarios",
    "lb_calculadoras",
    "lb_gomas_tijeras",
    "libro_tumbado",
    "portarretratos",
    "reloj_sobremesa",
    "lampara_mesa",
    "vb_cuaderno",
    "vb_despertador",
    "vb_ordenador",
    "movil",
    "cartera",
    "pila_jerseys_rojo",
    "pila_jerseys_azul_marino",
    "pila_jerseys_verde",
    "pila_jerseys_mostaza",
    "pila_jerseys_gris",
    "pila_jerseys_crudo",
    "pila_camisetas_blanca",
    "pila_camisetas_negra",
    "pila_camisetas_rosa",
    "pila_camisetas_turquesa",
    "pila_pantalones_beige",
    "pila_pantalones_gris",
    "mue_cojines_mostaza",
    "mue_cojines_verde",
    "mue_cojines_rojo",
    "mue_cojines_azul",
    "mue_manta_doblada",
    "per_perfume_azahar",
    "per_perfume_jazmin",
    "per_perfume_rosa_mayo",
    "per_perfume_lavanda",
    "per_perfume_sandalo",
    "per_perfume_ambar",
    "per_perfume_citrus",
    "per_perfume_brisa_marina",
    "per_perfume_vainilla",
    "per_perfume_noche_verano",
    "per_perfume_madera_noble",
    "per_perfume_almendro",
    "per_perfume_higuera",
    "per_perfume_romero",
    "per_perfume_pino",
    "per_perfume_caramelo",
    "per_perfume_violeta",
    "per_perfume_cuero",
    "per_perfume_ninos",
    "per_perfume_oud",
    "hilera_libros_a",
    "hilera_libros_b",
    "hilera_libros_c",
    "hilera_libros_d",
    "hilera_libros_e",
    "hilera_libros_f",
    "vb_joyero",
    "vb_hucha",
    "vb_gafas",
    "vb_zapatillas",
    "vb_ropa",
    "vb_colcha",
    "vb_cesto",
    "vb_cargador",
    "jarron_flores",
    "figura_porcelana",
    "telefono_casa",
    "manta_doblada",
    "cojin_suelto",
    "revista",
    "periodico",
    "velas"
   ],
   "en": [
    "vb_mesita",
    "vb_escritorio",
    "vb_estante_bajo",
    "estanteria_libros",
    "mesa_centro",
    "vb_comoda"
   ],
   "por_soporte": [
    3,
    6
   ]
  },
  {
   "zona": "estancia",
   "regla": "techo",
   "obj": "lampara_techo_salon",
   "por_m": [
    0.4,
    0.42
   ],
   "obligatorio": true
  }
 ],
 "iluminacion": {
  "fuentes": [
   1,
   3
  ],
  "temperatura_k": [
   2700,
   3000
  ],
  "minimo_lux_publico": 60
 },
 "ambiente": {
  "sonido": "casa",
  "vida": [
   "objetos cotidianos del hogar"
  ]
 },
 "minimo_objetos_distintos": 60,
 "moodboard": [
  {
   "titulo": "Twin Dolphin Hall new studio apartment 2.jpg",
   "url": "https://commons.wikimedia.org/wiki/File:Twin_Dolphin_Hall_new_studio_apartment_2.jpg",
   "autor": "Orderinchaos",
   "licencia": "CC BY-SA 4.0"
  },
  {
   "titulo": "Brno, koleje Tvrdého - interiér - pokoje 01.jpg",
   "url": "https://commons.wikimedia.org/wiki/File:Brno%2C_koleje_Tvrd%C3%A9ho_-_interi%C3%A9r_-_pokoje_01.jpg",
   "autor": "Kamil Czaiński",
   "licencia": "CC BY-SA 4.0"
  },
  {
   "titulo": "Brno, koleje Tvrdého - interiér - pokoje 02.jpg",
   "url": "https://commons.wikimedia.org/wiki/File:Brno%2C_koleje_Tvrd%C3%A9ho_-_interi%C3%A9r_-_pokoje_02.jpg",
   "autor": "Kamil Czaiński",
   "licencia": "CC BY-SA 4.0"
  },
  {
   "titulo": "DormITESMMonterrey 01.JPG",
   "url": "https://commons.wikimedia.org/wiki/File:DormITESMMonterrey_01.JPG",
   "autor": "Thelmadatter",
   "licencia": "CC BY-SA 3.0"
  },
  {
   "titulo": "DormITESMMonterrey 02.JPG",
   "url": "https://commons.wikimedia.org/wiki/File:DormITESMMonterrey_02.JPG",
   "autor": "Thelmadatter",
   "licencia": "CC BY-SA 3.0"
  },
  {
   "titulo": "UCLA dorm room.JPG",
   "url": "https://commons.wikimedia.org/wiki/File:UCLA_dorm_room.JPG",
   "autor": "Alton",
   "licencia": "Public domain"
  },
  {
   "titulo": "AEG in her dorm.jpg",
   "url": "https://commons.wikimedia.org/wiki/File:AEG_in_her_dorm.jpg",
   "autor": "Aeg823",
   "licencia": "CC BY-SA 4.0"
  },
  {
   "titulo": "WorkAfro's office in the dormitory.jpg",
   "url": "https://commons.wikimedia.org/wiki/File:WorkAfro%27s_office_in_the_dormitory.jpg",
   "autor": "Soulmwandi",
   "licencia": "CC BY-SA 4.0"
  },
  {
   "titulo": "1971-10 Chambre 201 de la fondation des États-Unis 1.jpg",
   "url": "https://commons.wikimedia.org/wiki/File:1971-10_Chambre_201_de_la_fondation_des_%C3%89tats-Unis_1.jpg",
   "autor": "Tangopaso",
   "licencia": "Public domain"
  },
  {
   "titulo": "Female student writing and studying at dorm room desk.jpg",
   "url": "https://commons.wikimedia.org/wiki/File:Female_student_writing_and_studying_at_dorm_room_desk.jpg",
   "autor": "English106",
   "licencia": "CC BY 2.0"
  }
 ]
}