{
 "tipologia": "dormitorio",
 "nombre": "Dormitorio de una casa del pueblo",
 "superficie": {
  "ancho": [
   3.2,
   7.8
  ],
  "fondo": [
   1.9,
   4.8
  ],
  "alto": 2.75
 },
 "variables": {},
 "puerta": -0.75,
 "paso_libre": 0.8,
 "zonas": [
  {
   "id": "estancia",
   "publica": true,
   "rect": [
    "-W/2",
    "0",
    "W/2",
    "D"
   ]
  }
 ],
 "tabiques": [],
 "objetos": [
  {
   "zona": "estancia",
   "regla": "contra_pared",
   "obj": "vb_cama_doble",
   "pared": "*",
   "cantidad": [
    1,
    1
   ],
   "obligatorio": true,
   "preferir": true,
   "habitacion": [
    "dorm"
   ],
   "area_max": 18,
   "centrado": true
  },
  {
   "zona": "estancia",
   "regla": "contra_pared",
   "obj": "vb_cama_amplia",
   "pared": "*",
   "cantidad": [
    1,
    1
   ],
   "obligatorio": true,
   "preferir": true,
   "habitacion": [
    "dorm"
   ],
   "area_min": 18,
   "centrado": true
  },
  {
   "zona": "estancia",
   "regla": "contra_pared",
   "variantes": [
    "vb_cama_individual",
    "vb_cama_doble"
   ],
   "pared": "*",
   "cantidad": [
    1,
    1
   ],
   "obligatorio": true,
   "preferir": true,
   "habitacion": [
    "dorm2"
   ]
  },
  {
   "zona": "estancia",
   "regla": "junto_a",
   "obj": "vb_mesita",
   "de": [
    "vb_cama_doble",
    "vb_cama_individual",
    "vb_cama_amplia"
   ],
   "cantidad": [
    1,
    1
   ],
   "obligatorio": true,
   "preferir": true
  },
  {
   "zona": "estancia",
   "regla": "contra_pared",
   "obj": "vb_armario",
   "pared": "*",
   "cantidad": [
    1,
    1
   ],
   "obligatorio": true,
   "preferir": true
  },
  {
   "zona": "estancia",
   "regla": "contra_pared",
   "obj": "vb_comoda",
   "pared": "*",
   "cantidad": [
    0,
    1
   ],
   "obligatorio": false,
   "preferir": true
  },
  {
   "zona": "estancia",
   "regla": "junto_a",
   "obj": "vb_mesita",
   "de": [
    "vb_cama_doble",
    "vb_cama_individual",
    "vb_cama_amplia"
   ],
   "cantidad": [
    0,
    1
   ],
   "obligatorio": false,
   "preferir": true,
   "area_min": 16
  },
  {
   "zona": "estancia",
   "regla": "contra_pared",
   "obj": "sillon_orejero",
   "pared": "*",
   "cantidad": [
    0,
    1
   ],
   "obligatorio": false,
   "preferir": true,
   "area_min": 16
  },
  {
   "zona": "estancia",
   "regla": "contra_pared",
   "obj": "vb_escritorio",
   "pared": "*",
   "cantidad": [
    0,
    1
   ],
   "obligatorio": false,
   "preferir": true,
   "area_min": 22
  },
  {
   "zona": "estancia",
   "regla": "junto_a",
   "obj": "silla_comedor",
   "de": "vb_escritorio",
   "cantidad": [
    0,
    1
   ],
   "obligatorio": false,
   "preferir": true,
   "lados": [
    "frente"
   ],
   "mira_ref": true,
   "area_min": 22
  },
  {
   "zona": "estancia",
   "regla": "contra_pared",
   "obj": "estanteria_libros",
   "pared": "*",
   "cantidad": [
    0,
    1
   ],
   "obligatorio": false,
   "preferir": true,
   "area_min": 22
  },
  {
   "zona": "estancia",
   "regla": "suelo_libre",
   "obj": "vb_alfombra",
   "cantidad": [
    0,
    1
   ],
   "area_min": 16,
   "area_max": 26
  },
  {
   "zona": "estancia",
   "regla": "suelo_libre",
   "obj": "vb_alfombra",
   "cantidad": [
    1,
    1
   ],
   "area_min": 26,
   "obligatorio": true
  },
  {
   "zona": "estancia",
   "regla": "pared",
   "variantes": [
    "fotos_familia",
    "cuadro_paisaje",
    "cuadro_foto_antigua",
    "cuadro_virgen",
    "poster_enmarcado"
   ],
   "pared": "*",
   "cantidad": [
    1,
    3
   ]
  },
  {
   "zona": "estancia",
   "regla": "sobre",
   "variantes": [
    "pila_jerseys_rojo",
    "pila_jerseys_azul_marino",
    "pila_jerseys_verde",
    "pila_jerseys_mostaza",
    "pila_jerseys_gris",
    "pila_jerseys_crudo",
    "pila_camisetas_blanca",
    "pila_camisetas_negra",
    "pila_camisetas_rosa",
    "pila_camisetas_turquesa",
    "pila_pantalones_beige",
    "pila_pantalones_gris",
    "mue_cojines_mostaza",
    "mue_cojines_verde",
    "mue_cojines_rojo",
    "mue_cojines_azul",
    "mue_manta_doblada",
    "per_perfume_azahar",
    "per_perfume_jazmin",
    "per_perfume_rosa_mayo",
    "per_perfume_lavanda",
    "per_perfume_sandalo",
    "per_perfume_ambar",
    "per_perfume_citrus",
    "per_perfume_brisa_marina",
    "per_perfume_vainilla",
    "per_perfume_noche_verano",
    "per_perfume_madera_noble",
    "per_perfume_almendro",
    "per_perfume_higuera",
    "per_perfume_romero",
    "per_perfume_pino",
    "per_perfume_caramelo",
    "per_perfume_violeta",
    "per_perfume_cuero",
    "per_perfume_ninos",
    "per_perfume_oud",
    "hilera_libros_a",
    "hilera_libros_b",
    "hilera_libros_c",
    "hilera_libros_d",
    "hilera_libros_e",
    "hilera_libros_f",
    "vb_despertador",
    "vb_joyero",
    "vb_hucha",
    "vb_gafas",
    "vb_zapatillas",
    "vb_ropa",
    "vb_colcha",
    "vb_cuaderno",
    "vb_cesto",
    "vb_cargador",
    "lampara_mesa",
    "libro_tumbado",
    "portarretratos",
    "reloj_sobremesa",
    "jarron_flores",
    "figura_porcelana",
    "telefono_casa",
    "manta_doblada",
    "cojin_suelto",
    "cartera",
    "movil",
    "revista",
    "periodico",
    "velas"
   ],
   "en": [
    "vb_mesita",
    "vb_comoda",
    "vb_escritorio"
   ],
   "por_soporte": [
    3,
    6
   ]
  },
  {
   "zona": "estancia",
   "regla": "techo",
   "obj": "lampara_techo_salon",
   "por_m": [
    0.4,
    0.42
   ],
   "obligatorio": true
  }
 ],
 "iluminacion": {
  "fuentes": [
   1,
   3
  ],
  "temperatura_k": [
   2700,
   3000
  ],
  "minimo_lux_publico": 60
 },
 "ambiente": {
  "sonido": "casa",
  "vida": [
   "objetos cotidianos del hogar"
  ]
 },
 "minimo_objetos_distintos": 60,
 "moodboard": [
  {
   "titulo": "Bedroom, Interior of apartment in Brisbane, 2025, 01.jpg",
   "url": "https://commons.wikimedia.org/wiki/File:Bedroom%2C_Interior_of_apartment_in_Brisbane%2C_2025%2C_01.jpg",
   "autor": "Chris Olszewski",
   "licencia": "CC BY-SA 4.0"
  },
  {
   "titulo": "Bedroom, Interior of apartment in Brisbane, 2025, 02.jpg",
   "url": "https://commons.wikimedia.org/wiki/File:Bedroom%2C_Interior_of_apartment_in_Brisbane%2C_2025%2C_02.jpg",
   "autor": "Chris Olszewski",
   "licencia": "CC BY-SA 4.0"
  },
  {
   "titulo": "LeHavre MaisonDel'Armateur Bedroom 1.jpg",
   "url": "https://commons.wikimedia.org/wiki/File:LeHavre_MaisonDel%27Armateur_Bedroom_1.jpg",
   "autor": "SF-scio24",
   "licencia": "CC0"
  },
  {
   "titulo": "LeHavre MaisonDel'Armateur Bedroom 2.jpg",
   "url": "https://commons.wikimedia.org/wiki/File:LeHavre_MaisonDel%27Armateur_Bedroom_2.jpg",
   "autor": "SF-scio24",
   "licencia": "CC0"
  },
  {
   "titulo": "Bedroom in Montacute House (8601909505).jpg",
   "url": "https://commons.wikimedia.org/wiki/File:Bedroom_in_Montacute_House_%288601909505%29.jpg",
   "autor": "xlibber",
   "licencia": "CC BY 2.0"
  },
  {
   "titulo": "Peles Castle Interior - Rococo Bedroom.jpg",
   "url": "https://commons.wikimedia.org/wiki/File:Peles_Castle_Interior_-_Rococo_Bedroom.jpg",
   "autor": "Carol I of Romania",
   "licencia": "CC BY-SA 4.0"
  },
  {
   "titulo": "AIMCO apartment bedroom.jpg",
   "url": "https://commons.wikimedia.org/wiki/File:AIMCO_apartment_bedroom.jpg",
   "autor": "Architecturist",
   "licencia": "CC BY-SA 3.0"
  },
  {
   "titulo": "Apartment Bedroom - Modulightor Building Paul Ruldolph.jpg",
   "url": "https://commons.wikimedia.org/wiki/File:Apartment_Bedroom_-_Modulightor_Building_Paul_Ruldolph.jpg",
   "autor": "Luke Butler",
   "licencia": "CC BY-SA 4.0"
  },
  {
   "titulo": "Apartment bedroom with parquet wood flooring.jpg",
   "url": "https://commons.wikimedia.org/wiki/File:Apartment_bedroom_with_parquet_wood_flooring.jpg",
   "autor": "Kurt Kaiser",
   "licencia": "CC0"
  },
  {
   "titulo": "Apartment bedroom with parquet wood flooring side 2.jpg",
   "url": "https://commons.wikimedia.org/wiki/File:Apartment_bedroom_with_parquet_wood_flooring_side_2.jpg",
   "autor": "Kurt Kaiser",
   "licencia": "CC0"
  }
 ]
}